{
  "schemaVersion": 1,
  "dbChangeUnit": "AceCommander-db-1.4.0",
  "appVersion": "1.4.0",
  "flywayTargetVersion": "1.4.2",
  "createdUtc": "2026-05-06T14:32:11Z",
  "createdFromGitTag": "v1.4.0",
  "createdFromGitSha": "8f4b2c1d3e5fa9c4b1f2e3d4a5b6c7d8e9f0a1b2",
  "files": [
    {
      "path": "flyway/V1.4.0__baseline_schema.sql",
      "kind": "migration",
      "checksumSha256": "bbbbbbbbbbbbbbbbbbbbbbbbbbbbbbbbbbbbbbbbbbbbbbbbbbbbbbbbbbbbbbbb"
    },
    {
      "path": "seed/S1_4_0_roles.csv",
      "kind": "seed",
      "checksumSha256": "cccccccccccccccccccccccccccccccccccccccccccccccccccccccccccccccc"
    },
    {
      "path": "seed/S1_4_0_roles_load.sql",
      "kind": "seedLoader",
      "checksumSha256": "dddddddddddddddddddddddddddddddddddddddddddddddddddddddddddddddd"
    }
  ],
  "expectedRowCounts": {
    "Roles": 3
  },
  "rollbackSupported": false,
  "rollbackNotes": "Fixture rollback notes."
}
